{
  "api_version": "moduregis.io/v1alpha1",
  "kind": "HTTPExecutorAdapter",
  "adapter_ref": "adapter://axisvela.http.hr@1.0.0",
  "base_url": "https://hr.synthetic.invalid",
  "grant_delivery": "authorization_header",
  "timeouts": {
    "connect_ms": 1000,
    "response_header_ms": 2000,
    "request_ms": 5000
  },
  "tls": {
    "server_name": "hr.synthetic.invalid",
    "ca_bundle_ref": "evidence://synthetic/hr-ca-v1",
    "mtls_required": false
  },
  "egress_policy": {
    "allowed_hosts": ["hr.synthetic.invalid"],
    "reject_private_addresses": true
  },
  "routes": {
    "create_employee": {
      "method": "POST",
      "path": "/v1/synthetic-employees",
      "input_schema_ref": "schemas/create-employee-input.json",
      "output_schema_ref": "schemas/create-employee-output.json",
      "response": {
        "execution_reference_field": "execution_ref",
        "outcome_reference_field": "outcome_ref",
        "evidence_references_field": "evidence_refs"
      }
    }
  }
}
